<?xml version='1.0' encoding='utf-8'?>
<signalDefinitions xmlns:xsi="http://www.w3.org/2001/XMLSchema-instance" xsi:noNamespaceSchemaLocation="signals.xsd">
  <signal country="us" name="US-3-aspect-vertical" svg="US-3-aspect-vertical.svg">
    <lightbulbs>
      <lightbulb id="L1" x="0" y="500" color="green" />
      <lightbulb id="L2" x="0" y="0" color="yellow" />
      <lightbulb id="L3" x="0" y="-500" color="red" />
    </lightbulbs>
    <aspects>
      <aspect name="Stop" short="Stop" long="Stop">
        <light id="L3" />
      </aspect>
      <aspect name="Clear" short="Clear" long="Clear">
        <light id="L1" />
      </aspect>
      <aspect name="Approach" short="Approach" long="Approach">
        <light id="L2" />
      </aspect>
    </aspects>
  </signal>
</signalDefinitions>