<?xml version='1.0' encoding='utf-8'?>
<signalDefinitions xmlns:xsi="http://www.w3.org/2001/XMLSchema-instance" xsi:noNamespaceSchemaLocation="signals.xsd">
  <signal country="ch" name="CH-Raeumungssignal" svg="CH-Raeumungssignal.svg" outline="M -260,260 L 260,260 L 260,-260 L -260,-260 Z" outlineColor="#000000">
    <lightbulbs>
      <lightbulb id="L1" x="-200" y="200" color="white" d="m -40, 0 a 40,40 0 1,0 80,0 a 40,40 0 1,0 -80,0" />
      <lightbulb id="L3" x="0" y="200" color="white" d="m -40, 0 a 40,40 0 1,0 80,0 a 40,40 0 1,0 -80,0" />
      <lightbulb id="L5" x="200" y="200" color="white" d="m -40, 0 a 40,40 0 1,0 80,0 a 40,40 0 1,0 -80,0" />
      <lightbulb id="L7" x="-100" y="100" color="white" d="m -40, 0 a 40,40 0 1,0 80,0 a 40,40 0 1,0 -80,0" />
      <lightbulb id="L8" x="0" y="100" color="white" d="m -40, 0 a 40,40 0 1,0 80,0 a 40,40 0 1,0 -80,0" />
      <lightbulb id="L9" x="100" y="100" color="white" d="m -40, 0 a 40,40 0 1,0 80,0 a 40,40 0 1,0 -80,0" />
      <lightbulb id="L11" x="-200" y="0" color="white" d="m -40, 0 a 40,40 0 1,0 80,0 a 40,40 0 1,0 -80,0" />
      <lightbulb id="L12" x="-100" y="0" color="white" d="m -40, 0 a 40,40 0 1,0 80,0 a 40,40 0 1,0 -80,0" />
      <lightbulb id="L13" x="0" y="0" color="white" d="m -40, 0 a 40,40 0 1,0 80,0 a 40,40 0 1,0 -80,0" />
      <lightbulb id="L14" x="100" y="0" color="white" d="m -40, 0 a 40,40 0 1,0 80,0 a 40,40 0 1,0 -80,0" />
      <lightbulb id="L15" x="200" y="0" color="white" d="m -40, 0 a 40,40 0 1,0 80,0 a 40,40 0 1,0 -80,0" />
      <lightbulb id="L17" x="-100" y="-100" color="white" d="m -40, 0 a 40,40 0 1,0 80,0 a 40,40 0 1,0 -80,0" />
      <lightbulb id="L18" x="0" y="-100" color="white" d="m -40, 0 a 40,40 0 1,0 80,0 a 40,40 0 1,0 -80,0" />
      <lightbulb id="L19" x="100" y="-100" color="white" d="m -40, 0 a 40,40 0 1,0 80,0 a 40,40 0 1,0 -80,0" />
      <lightbulb id="L21" x="-200" y="-200" color="white" d="m -40, 0 a 40,40 0 1,0 80,0 a 40,40 0 1,0 -80,0" />
      <lightbulb id="L23" x="0" y="-200" color="white" d="m -40, 0 a 40,40 0 1,0 80,0 a 40,40 0 1,0 -80,0" />
      <lightbulb id="L25" x="200" y="-200" color="white" d="m -40, 0 a 40,40 0 1,0 80,0 a 40,40 0 1,0 -80,0" />
    </lightbulbs>
    <aspects>
      <aspect name="Rangieren verboten" short="Verboten" long="Rangieren verboten">
        <light id="L1" />
        <light id="L7" />
        <light id="L13" />
        <light id="L19" />
        <light id="L25" />
        <light id="L21" />
        <light id="L17" />
        <light id="L9" />
        <light id="L5" />
      </aspect>
      <aspect name="Rangieren gestattet" short="Gestattet" long="Rangieren gestattet">
        <light id="L3" />
        <light id="L8" />
        <light id="L13" />
        <light id="L18" />
        <light id="L23" />
      </aspect>
      <aspect name="Rangieren erlaubt" short="Erlaubt" long="Rangieren erlaubt">
        <light id="L3" />
        <light id="L8" />
        <light id="L13" />
        <light id="L18" />
        <light id="L23" />
      </aspect>
    </aspects>
  </signal>
</signalDefinitions>