<?xml version='1.0' encoding='utf-8'?>
<signalDefinitions xmlns:xsi="http://www.w3.org/2001/XMLSchema-instance" xsi:noNamespaceSchemaLocation="signals.xsd">
  <signal country="fr" name="FR-Carre-Violet-1" svg="FR-Carre-Violet-1.svg">
    <lightbulbs>
      <lightbulb id="L1" x="0" y="0" color="violet" />
      <lightbulb id="L2" x="0" y="-50" color="white" />
    </lightbulbs>
    <aspects>
      <aspect name="Carré violet" short="Cv" long="Carré violet">
        <light id="L1" />
      </aspect>
      <aspect name="Manoeuvre" short="M" long="Manoeuvre">
        <light id="L2" />
      </aspect>
    </aspects>
  </signal>
</signalDefinitions>