<?xml version='1.0' encoding='utf-8'?>
<signalDefinitions xmlns:xsi="http://www.w3.org/2001/XMLSchema-instance" xsi:noNamespaceSchemaLocation="signals.xsd">
  <signal country="at" name="AT-Hauptsignal-1" svg="AT-Hauptsignal-1.svg">
    <lightbulbs>
      <lightbulb id="L1" x="-250" y="500" color="green" />
      <lightbulb id="L2" x="250" y="0" color="red" />
      <lightbulb id="L3" x="250" y="500" color="yellow" />
      <lightbulb id="L4" x="-250" y="0" color="green" />
    </lightbulbs>
    <aspects>
      <aspect name="Halt" short="Halt" long="Halt">
        <light id="L2" />
      </aspect>
      <aspect name="Frei" short="Frei" long="Frei">
        <light id="L1" />
      </aspect>
      <aspect name="Frei mit 60 km/h" short="Frei 60" long="Frei mit 60 km/h">
        <light id="L1" />
        <light id="L4" />
      </aspect>
      <aspect name="Frei mit 40 km/h" short="Frei 40" long="Frei mit 40 km/h">
        <light id="L1" />
        <light id="L3" />
      </aspect>
    </aspects>
  </signal>
</signalDefinitions>
