<?xml version='1.0' encoding='utf-8'?>
<signalDefinitions xmlns:xsi="http://www.w3.org/2001/XMLSchema-instance" xsi:noNamespaceSchemaLocation="signals.xsd">
  <signal country="pl" name="PL-Hauptsignal-5L" svg="PL-Hauptsignal-5L.svg" outline="M -200,600 L 200,600 L 200,-600 L -200,-600 Z" outlineColor="#000000">
    <lightbulbs>
      <lightbulb id="L1" x="0" y="400" color="green" d="m -100, 0 a 100,100 0 1,0 200,0 a 100,100 0 1,0 -200,0" />
      <lightbulb id="L2" x="0" y="200" color="orange" d="m -100, 0 a 100,100 0 1,0 200,0 a 100,100 0 1,0 -200,0" />
      <lightbulb id="L3" x="0" y="0" color="red" d="m -100, 0 a 100,100 0 1,0 200,0 a 100,100 0 1,0 -200,0" />
      <lightbulb id="L4" x="0" y="-200" color="orange" d="m -100, 0 a 100,100 0 1,0 200,0 a 100,100 0 1,0 -200,0" />
      <lightbulb id="L5" x="0" y="-400" color="white" d="m -100, 0 a 100,100 0 1,0 200,0 a 100,100 0 1,0 -200,0" />
    </lightbulbs>
    <aspects>
      <aspect name="S1 Stój" short="S1" long="Stój">
        <light id="L3" />
      </aspect>
      <aspect name="S2 Vmax" short="S2" long="Jazda z największą dozwoloną prędkością">
        <light id="L1" />
      </aspect>
      <aspect name="S3 Vmax (n. 100)" short="S3" long="Jazda Vmax, następnie 100 km/h">
        <light id="L1" />
      </aspect>
      <aspect name="S4 Vmax (n. 40/60)" short="S4" long="Jazda Vmax, następnie 40/60 km/h">
        <light id="L2" />
      </aspect>
      <aspect name="S5 Vmax (n. Stój)" short="S5" long="Jazda Vmax, następnie Stój">
        <light id="L2" />
      </aspect>
      <aspect name="S10 40 (n. Vmax)" short="S10" long="Jazda 40 km/h, następnie Vmax">
        <light id="L1" />
        <light id="L4" />
      </aspect>
      <aspect name="S11 40 (n. 100)" short="S11" long="Jazda 40 km/h, następnie 100 km/h">
        <light id="L1" />
        <light id="L4" />
      </aspect>
      <aspect name="S12 40 (n. 40/60)" short="S12" long="Jazda 40 km/h, następnie 40/60 km/h">
        <light id="L2" />
        <light id="L4" />
      </aspect>
      <aspect name="S13 40 (n. Stój)" short="S13" long="Jazda 40 km/h, następnie Stój">
        <light id="L2" />
        <light id="L4" />
      </aspect>
      <aspect name="Sz Sygnał Zastępczy" short="Sz" long="Sygnał Zastępczy">
        <light id="L3" />
        <light id="L5" />
      </aspect>
    </aspects>
  </signal>
</signalDefinitions>